{
  "request_id": "req-004",
  "agent": "grafana-agent",
  "status": "failed",
  "service": "payment-service",
  "time_range": {
    "from": "2026-04-25T11:00:00Z",
    "to": "2026-04-25T12:00:00Z"
  },
  "metric_intent": "general_health",
  "selected_metrics": [],
  "metrics": [],
  "warnings": [],
  "error": {
    "code": "SERVICE_NOT_FOUND",
    "message": "No metrics catalog found for service payment-service",
    "details": {
      "service": "payment-service"
    }
  },
  "handoff": null
}
