{
  "request_id": "req-003",
  "agent": "grafana-agent",
  "status": "success",
  "service": "checkout-service",
  "time_range": {
    "from": "2026-04-25T11:00:00Z",
    "to": "2026-04-25T12:00:00Z"
  },
  "metric_intent": "general_health",
  "selected_metrics": [
    "cpu_usage",
    "memory_usage",
    "error_rate",
    "request_latency_p95"
  ],
  "metrics": [
    {
      "name": "cpu_usage",
      "unit": "percent",
      "points": [
        {
          "timestamp": "2026-04-25T11:00:00Z",
          "value": 42.0
        },
        {
          "timestamp": "2026-04-25T11:10:00Z",
          "value": 88.0
        }
      ]
    },
    {
      "name": "memory_usage",
      "unit": "percent",
      "points": [
        {
          "timestamp": "2026-04-25T11:00:00Z",
          "value": 61.0
        },
        {
          "timestamp": "2026-04-25T11:10:00Z",
          "value": 72.0
        }
      ]
    },
    {
      "name": "error_rate",
      "unit": "percent",
      "points": [
        {
          "timestamp": "2026-04-25T11:30:00Z",
          "value": 0.3
        },
        {
          "timestamp": "2026-04-25T11:50:00Z",
          "value": 4.5
        }
      ]
    },
    {
      "name": "request_latency_p95",
      "unit": "milliseconds",
      "points": [
        {
          "timestamp": "2026-04-25T11:00:00Z",
          "value": 120.0
        },
        {
          "timestamp": "2026-04-25T11:10:00Z",
          "value": 850.0
        }
      ]
    }
  ],
  "warnings": [],
  "error": null,
  "handoff": {
    "next_agent": "metric-analyzer-agent",
    "reason": "metrics_ready_for_analysis"
  }
}
